{
  "id": "6a14c4f1-7c4d-4e65-a7d9-39b2a95f4b1a",
  "name": "commerce",
  "services": [
    {
      "service_id": "order-worker",
      "name": "order-worker",
      "revision": 1,
      "active": true,
      "rulesets": [
        {
          "ruleset_id": "order-review",
          "revision": 3
        },
        {
          "ruleset_id": "order-notification",
          "revision": 7
        }
      ],
      "worker_profile": {
        "min_replicas": 1,
        "max_replicas": 4,
        "concurrency": 8
      }
    },
    {
      "service_id": "payment-worker",
      "name": "payment-worker",
      "revision": 1,
      "active": true,
      "rulesets": [
        {
          "ruleset_id": "payment-risk",
          "revision": 2
        },
        {
          "ruleset_id": "payment-notification",
          "revision": 1
        }
      ],
      "worker_profile": {
        "min_replicas": 1,
        "max_replicas": 2,
        "concurrency": 4
      }
    }
  ],
  "created_at": "2026-10-15T07:30:00Z",
  "updated_at": "2026-10-15T07:30:00Z"
}
